,User ID,Username,Title,Stars,Date,Review
70,71,JustUs710,Apple Watch Compatiblity,5,2020-08-27 22:38:03,"I am unable to get it on my watch, working in a hospital it’s not feasible for me to walk around with the phone."
71,72,heyijustwanna,Works great,5,2020-08-06 15:57:20,I wish it showed live how many pings it has received from other phones.
72,73,madison12069,Thank you,5,2020-08-06 00:24:41,Thank you for the private way to keep my family safe and aware!
73,74,sh33va,Add testing sites??,4,2020-08-05 23:22:57,Very cool!! I appreciate living in a state that is taking our health seriously. Only note for the developer team... wish the app had a feature to locate free testing near you. Otherwise AWESOME.
74,75,Turbo Turducken,No feedback,4,2020-08-18 16:18:44,"Provides no feedback about the number of other users it’s detected, so there’s no real for the individual to know if it’s working"
75,76,Hackeynut,Glad to do my part,5,2020-08-06 13:15:07,Glad to see VA adopting this model that has been so effective in other countries.
76,77,jake.griffin,Impressed,5,2020-08-09 19:38:24,Wow! Great job Virginia creating a contact-tracing app without asking for location or personal identifiers. Gives me a lot of faith in my state.
77,78,Thea In VA,No longer updating,2,2020-08-11 01:10:02,Downloaded and was working great. Now it hasn’t checked or created a log since 1:11 am on 8/7.  There’s no way to troubleshoot or get help. Please fix so it will work again. This is a much needed tool for everyone to help stay safe.
78,79,FellowVirginian!,Enable button doesn’t work?,2,2020-08-05 22:56:33,"Hello! I am a fellow Virginian who cares about the health and safety of my community, so I was a little disappointed when I went on the app and I couldn’t press the enable button to “sensor” for COVID-19 bacteria. I know you are just releasing this, so take your time fixing any bugs. Thanks!"
79,80,gunman8870,Boomers,5,2020-10-20 00:58:20,Don’t listen to all the boomers that don’t know how to set up an app that takes less then a minute lol.
80,81,Orb Sportsball,"Simple, clear set up",5,2020-08-05 21:00:07,"It was quick to set up, and the methodology was made very clear. Good job, Virginia"
81,82,Joe_149,Supports only iOS 13??????,1,2020-08-07 14:00:24,"This app has no features that would prevent it from supporting earlier versions of iOS.  This prevents its use on, for example, iPhone 6, a common phone. 

For an app whose value lies in widespread adoption, this is unacceptable!!

Please tell the developer to change the OS support setting in XCode, rebuild and release this app for earlier versions."
82,83,Sumedh03,Works perfectly.,5,2020-08-16 02:52:04,I hope many VA residents download this app. It protects privacy and works perfectly.
83,84,Thump3rRocks,Fantastic.,5,2020-08-05 19:55:05,Now if we can just get everyone to install and use this.
84,85,DIAMOND 922,App not working,5,2020-10-26 23:22:07,Hi my COVIDWISE app is not working! Is their anyway I can fix it and I can’t see my exposure checks at all please fix it
85,86,cupochicken,Very useful app that everyone in Virginia needs to download,5,2020-09-27 03:41:43,"If everyone got this app, we can finally get rid of COVID."
86,87,GnateTheGreat,Easy to use,5,2020-08-06 15:49:44,Easy to use and a great step forward for the state. Everyone please get this app!
87,88,cameraphone91,thank you,5,2020-08-20 21:08:01,"Our species is dying. Together, we can beat this. Wear your masks. Stay six feet apart. Stop taking sides. Politics, skin color, gender? Bless u all"
88,89,Harize,Download. No Need To Fear About Privacy.,5,2020-08-06 14:57:41,"The app itself is nice, clean, and intuitive. From somebody who knows tech, this is a very secure app."
89,90,jgray94,Error when enabling Exposure Notifications,1,2020-08-08 13:39:03,What’s the point of the app if the setup process can not be completed? Getting an error: “The operation couldn’t be completed. (ENErrorDomain error 14.)” Also no my phone isn’t running iOS 14 beta. It’s running iOS 13.6 with Bluetooth and Notifications enabled.
90,91,APriday,Very convenient!,5,2020-08-05 22:34:16,Super easy way to track exposure and transmission!  I hope all states adopt this app!
91,92,Dcpaskie,Great app but would add vaccine,4,2020-12-18 17:41:11,It’s a great app. I would say that it would be extra useful if you add a tracking for self-reporting vaccine being administered.
92,93,LightBox22,Won’t uninstall,1,2020-09-30 11:35:56,I’m uncertain but I believe this app may be draining my battery. Since ios14 the health app is the using 36% of my battery health while using almost no on screen time. I turned off the covid tracking and am unable to “Remove” the app by long pressing on the app icon.
93,94,casawi86,No GPS data is colleceted,5,2020-08-06 05:04:25,I hope more people will use it to stop the spread of the virus.
94,95,Anemone34,Error-Doesn’t work,1,2020-08-17 15:12:35,"I’m getting an error at the screen to enable exposure notifications. It says operation couldn’t be completed. I’m using iOS 13.6.

I went through steps developer outlined in other reviews. Still doesn’t work. Pretty frustrating."
95,96,1 Star all you deserve,This app is missing the most important reason to exist,1,2020-09-28 22:12:50,I personally know over 25 positive cases in Roanoke City right now. This app unfortunately has not detected or reported them. I don’t work close to the them or in they’re department and had not been told anything by those in HR.
96,97,unknown??????unknown,Thanks,5,2020-09-10 17:37:50,Thanks for spending the time and effort to paylessly make this and keep us safe :)
97,98,iNomis,Needs better battery management,2,2020-08-11 12:50:14,This app is great except for me it uses too much of the battery. Not sure if there is way to fix but want developers to know it’s an issue.
98,99,chrisvonsimson,Really clear and easy,5,2020-08-05 19:48:41,"Super easy way to help yourself and others, for free."
99,100,Joannski3,Doesn’t work,1,2020-12-31 21:12:17,"Got my text to say I tested positive for covid from my swab on 12/27. I looked at the lab results and had a 6 digit number that ended in a -6 (I did not not could include the dash).

Have no idea how I’m supposed to notify others exposed to me if I can’t even get a pin"
100,101,Mazeppa,The commonwealth leads the way!,5,2020-08-06 02:30:27,Very proud of Virginia for being the first state to launch a coronavirus tracking app!
101,102,Tom from Wmsbg,R Thompson,5,2020-08-05 18:57:24,Proud of our state leadership and collaboration in a time when it is so vitality needed.  Another excellent initiative in this battle!
102,103,Steve Davidson,So glad VA offers this,5,2020-10-26 03:56:17,Everyone should have this app!
103,104,potentialdem503,Great app,5,2020-08-05 23:02:44,"This app is a great way to keep Virginians safer, definitely would recommend it!"
104,105,hehsbebdvcgshbdbs,Good job!,5,2020-08-26 16:28:37,I’m so happy that we’re taking more steps to try and fight COVID-19! Thank you for this app. 👍🏼
105,106,RaghuPole,Not able to use,1,2020-08-11 12:49:25,"Getting error while enabling notifications and there is no info on how to troubleshoot. 

Update: thanks for the developer to send me instructions but the link provided is not accessible. I’m getting access denied."
106,107,Dwdwdw1985,Use this!,5,2020-08-06 15:47:49,The security and privacy promises are legitimate. Use this app to help slow the spread of the virus.
107,108,Bruingolf04,Happy to see it,5,2020-08-05 14:23:40,Glad VA is ahead of the game utilizing available tech to bring awareness to the risks.
108,109,Chloe8950,Easy & Private,5,2020-08-06 02:05:01,Looks well done.
109,110,Slurm_Loco,Tested positive and wasn’t able to use the app,1,2020-12-19 00:28:09,I tested positive and I tried to use COVIDWISE to alert others. Unfortunately I was never able to as I never received the pin needed to send the message out. What’s the point of the app if I can’t get a pin?
110,111,jessappleg8,Thankful,5,2020-08-05 19:55:28,I’m thankful for an app like this and for a state with a governor who’s educated and does what’s best for our state. Great idea.
111,112,chuckadisc,Happy to Help!,5,2020-08-05 23:31:27,Very excited this is finally ready!
112,113,Rory A,Doesn’t work,1,2020-12-13 01:56:01,Tried to report a positive case “me” I needed a PIN number and didn’t give me away to get one. Have no interest in having apps that don’t work on my phone.  Also failing to send status reports.
113,114,Hungercraft,Not From VA,5,2020-08-05 15:19:54,Nothing about this technology gates this to only users in VA. I'm in WA and downloaded this. Spread this app!
114,115,Miyhishia,confused??,1,2020-08-22 23:43:15,I received a push notification that I came in contact however when i open the app it says no exposure. I can no longer find these notifications was I exposed or no????
115,116,Suryonhan,Awesome app,5,2020-08-06 19:29:26,Super simple and love the interface. Thank you!!!
116,117,EdgiestSafe,ultimate battery sucker,1,2020-12-26 01:48:31,I reinstalled the app because I needed something to drain my battery quickly so that I could test how quickly the phone would charge back up.
117,118,Rw tarot,Covid logs not working,1,2020-08-10 19:09:11,I love the concept but my log exposures have not been working since aug 7 and i have friends that say theyre having the same issue with this pls fix it asap so we can use this great idea to help beat covid 🙏🏻🙏🏻🙏🏻
118,119,*****yea,I can't turn on notifications,1,2020-08-08 15:30:49,"I get an error that says ENErrorDomain error 14. Will update review when fixed but the app is useless for me now.

Update: I'm on iOS 13.5 and still seeing this. I'm not on the iOS 14 beta."
119,120,parents js,100% Recommend,5,2020-08-05 18:54:47,This app helps all of us Virginians be safer!
120,121,HollyDay,Good for VA,5,2020-08-05 22:36:40,Northam has done things correctly throughout this pandemic.
121,122,Douglas F. Williams,Heavy battery drain,3,2020-08-08 17:13:40,Using about 27% of battery for the past 24 hours.
122,123,mamabear20141,App is a joke,1,2020-11-30 18:44:22,"My husband tested positive and he was never given a way to let the app know. Never once did the app notify me of being around anyone, especially my husband."
123,124,HamletsGhost8,🤗,5,2020-08-05 18:32:44,"Again, Northam leads in getting ahead of Covid. Great news."
124,125,Serenitypinkmccoy,AMAZING,5,2020-08-21 16:08:43,Let’s get other states to use this!
125,126,SDRice,Doesn’t install,1,2020-12-07 21:22:35,Just gets stuck in a constant loop of asking me to turn on exposure notifications. Goes back and forth between setting and COVIDWISE. It never turns on.
126,127,interlard,Annoying Bluetooth alert every day!,1,2020-11-08 15:56:43,Every day I turn off airplane mode this stupid app pops up an alert to tell me out only works when Bluetooth is enabled. Argh!!
127,128,deckhopper,No Dark Mode!,3,2020-08-06 09:37:52,Dark mode missing. Please add to feature request. Otherwise a good app.
128,129,Rlcbm,Drains too much battery on iPhone 7,3,2020-09-15 18:47:39,It used 70 percent of my battery
129,130,hshshhshs20,This is great!,5,2020-08-05 23:10:23,This is a great app! We need this to help slow the spread!!
130,131,Jackhowa,"Awaiting other states, including Illinois",5,2020-08-05 18:24:50,Great job Virginia
131,132,Tracy303xana,Downloaded but keep getting error message,1,2020-08-05 17:37:28,No point. Only getting an error message.
132,133,wishicouldparticipate,Doesn’t Work on Older Model Phones,2,2020-08-09 16:27:06,Great idea but won’t work on older model iPhones. This locks out a large portion of the population.
133,134,Lyve1,State regulation,4,2020-09-16 02:28:32,Does this work outside of the state of Virginia? I live in another state.
134,135,aaront10,Can’t turn on notifications,1,2020-08-07 14:28:20,Receive an error trying to enable notifications. iPhone X
135,136,rjl_1,Notification error,1,2020-08-06 20:08:12,When I try to enable the notifications I keep getting a “ENErrorDomain error 14” error flag.  Do you why that might be?
136,137,AngrySysAdmin,No IOS 12.5 Support,1,2020-12-15 13:21:17,This isn’t that complicated of an app. Why aren’t older versions of IOS and older phone supported?
137,138,Liam patrinicola,First,5,2020-08-05 18:15:19,"Great app, I was the 3rd on to download it."
138,139,Muyserio,No longer working,1,2020-11-25 03:33:07,Why is Application no longer working?
139,140,yorktownman,Needs a way to cancel wrong report,1,2020-11-19 01:04:10,I inadvertently activated the testing positive notification. There is no way to go back.
140,141,LochNessMonster.,this app is so important!,5,2020-08-07 13:42:26,please download it so that we can help our communities survive!
141,142,iAddict mom,Concept 5 star - process Negative stars,1,2020-10-08 13:43:23,You can not report a positive test without talking to VDH.   I had an exposure and positive test 9/18.  VDH called me 10/7.   What good is that?
142,143,carjs,Worth downloading,4,2020-09-06 22:19:15,Worth downloading just tryna spread  awareness
143,144,ehutz12,COVIDIMPRESSED,5,2020-08-09 21:50:56,Great job Virginia. I appreciate the no GPS tracking.
144,145,DrNitro121,Essential for slowing the spread,5,2020-08-21 19:55:39,Essential for slowing the spread
145,146,joedmv,No help,1,2020-11-29 20:06:25,"No a single exposure detected after using for months, no use."
146,147,Mustafa Toraman,Awesome!,5,2020-08-06 02:05:05,Well done!
147,148,BigMoSho,Great App for,1,2020-08-15 02:27:14,"This is a great app if you like to be spied on, avoid it at all costs if you have any regard for your privacy!"
148,149,GabbySyndromn,trumpswetcoochie,5,2020-08-23 00:54:54,tiktok sent me 😁 so uh i hope this all works
149,150,Vabeachdebi,Go VA!,5,2020-08-05 23:36:44,"Stay safe, Stay healthy VA!  Good job!"
150,151,CollegeKid123952,App crashes,1,2020-08-05 18:37:17,Doesn't work
151,152,CR7KICKER,Great,5,2020-08-06 01:02:03,Good
152,153,markbyrn,High Battery Use,2,2020-10-24 14:42:26,Not good
153,154,Dick LeBoof,Error on “enable exposure notification” screen,1,2020-08-06 03:07:24,ENErrorDomain error 14
154,155,Keisha Taylor,great idea,3,2020-08-16 14:09:34,"please make this accessible nation wide, it’s not fair."
155,156,Alex Moir,Virginia only,1,2020-09-09 02:26:03,Virginia only. Worthless in NY.
156,157,夏莲妹,good,5,2020-08-06 00:24:07,good
157,158,ThatBillyBoy,Outdated and not useful,2,2020-12-15 18:13:49,"I have the app for two months. I tested positive today and tried to notify others with this app. Well it will take an additional 3 days to receive a code to start sharing this info. It took another 4 days to get my results due to testing appointment demand. In other words it has been already 7 days where the virus spreads without control before anyone gets a notification.
Update: Now it has been two weeks since my positive test an still no one gave me a code to update my status in this app."
158,159,kb 9193,Error,1,2020-08-12 22:30:59,"I receive ENDomainError Code 14 when trying to enable the app. I am running iOS 13.6, so it should work. Does VPN impact this app?"
159,160,waterman42069,Domain error 14,1,2020-08-06 00:40:58,"Loaded the app, but it sent an error code when I tried to enable the notifications."
160,161,wpugh,"Glad to see Virginia taking the lead, app is solid",5,2020-08-06 00:08:11,"I’ve had a chance to review the source code for the app and understand their design. This is a solid implementation, and will help control the spread of COVID-19"
